[
  {
    "id": "PROV-050001",
    "source_id": "SRC-050001",
    "retrieved_at": "2026-09-20T14:45:00Z",
    "canonical_url": "https://purplebooksearch.fda.gov/index.cfm?blaNo=103792&event=productdetails",
    "external_version": null,
    "content_hash": null,
    "license": null,
    "independence_group": "https://purplebooksearch.fda.gov/index.cfm?blaNo=103792&event=productdetails",
    "derived_from_source_ids": [],
    "notes": "FE-05 foundational baseline provenance; canonical source checked during baseline construction.",
    "observed_at": "2026-09-20T14:45:00Z",
    "valid_from": "2026-09-20T14:45:00Z",
    "valid_to": null
  },
  {
    "id": "PROV-050002",
    "source_id": "SRC-050002",
    "retrieved_at": "2026-09-20T14:45:00Z",
    "canonical_url": "https://www.accessdata.fda.gov/scripts/opdlisting/oopd/detailedIndex.cfm?cfgridkey=140100",
    "external_version": null,
    "content_hash": null,
    "license": null,
    "independence_group": "https://www.accessdata.fda.gov/scripts/opdlisting/oopd/detailedIndex.cfm?cfgridkey=140100",
    "derived_from_source_ids": [],
    "notes": "FE-05 foundational baseline provenance; canonical source checked during baseline construction.",
    "observed_at": "2026-09-20T14:45:00Z",
    "valid_from": "2026-09-20T14:45:00Z",
    "valid_to": null
  },
  {
    "id": "PROV-050003",
    "source_id": "SRC-050003",
    "retrieved_at": "2026-09-20T14:45:00Z",
    "canonical_url": "https://purplebooksearch.fda.gov/index.cfm?blaNo=125197&event=productdetails",
    "external_version": null,
    "content_hash": null,
    "license": null,
    "independence_group": "https://purplebooksearch.fda.gov/index.cfm?blaNo=125197&event=productdetails",
    "derived_from_source_ids": [],
    "notes": "FE-05 foundational baseline provenance; canonical source checked during baseline construction.",
    "observed_at": "2026-09-20T14:45:00Z",
    "valid_from": "2026-09-20T14:45:00Z",
    "valid_to": null
  },
  {
    "id": "PROV-050004",
    "source_id": "SRC-050004",
    "retrieved_at": "2026-09-20T14:45:00Z",
    "canonical_url": "https://www.fda.gov/vaccines-blood-biologics/cellular-gene-therapy-products/kymriah",
    "external_version": null,
    "content_hash": null,
    "license": null,
    "independence_group": "https://www.fda.gov/vaccines-blood-biologics/cellular-gene-therapy-products/kymriah",
    "derived_from_source_ids": [],
    "notes": "FE-05 foundational baseline provenance; canonical source checked during baseline construction.",
    "observed_at": "2026-09-20T14:45:00Z",
    "valid_from": "2026-09-20T14:45:00Z",
    "valid_to": null
  },
  {
    "id": "PROV-050005",
    "source_id": "SRC-050005",
    "retrieved_at": "2026-09-20T14:45:00Z",
    "canonical_url": "https://www.fda.gov/drugs/drug-approvals-and-databases/fda-approves-pembrolizumab-first-line-treatment-msi-hdmmr-colorectal-cancer",
    "external_version": null,
    "content_hash": null,
    "license": null,
    "independence_group": "https://www.fda.gov/drugs/drug-approvals-and-databases/fda-approves-pembrolizumab-first-line-treatment-msi-hdmmr-colorectal-cancer",
    "derived_from_source_ids": [],
    "notes": "FE-05 foundational baseline provenance; canonical source checked during baseline construction.",
    "observed_at": "2026-09-20T14:45:00Z",
    "valid_from": "2026-09-20T14:45:00Z",
    "valid_to": null
  },
  {
    "id": "PROV-050006",
    "source_id": "SRC-050006",
    "retrieved_at": "2026-09-20T14:45:00Z",
    "canonical_url": "https://www.nature.com/articles/nature08221",
    "external_version": null,
    "content_hash": null,
    "license": null,
    "independence_group": "https://www.nature.com/articles/nature08221",
    "derived_from_source_ids": [],
    "notes": "FE-05 foundational baseline provenance; canonical source checked during baseline construction.",
    "observed_at": "2026-09-20T14:45:00Z",
    "valid_from": "2026-09-20T14:45:00Z",
    "valid_to": null
  },
  {
    "id": "PROV-050007",
    "source_id": "SRC-050007",
    "retrieved_at": "2026-09-20T14:45:00Z",
    "canonical_url": "https://www.nature.com/articles/nature10600",
    "external_version": null,
    "content_hash": null,
    "license": null,
    "independence_group": "https://www.nature.com/articles/nature10600",
    "derived_from_source_ids": [],
    "notes": "FE-05 foundational baseline provenance; canonical source checked during baseline construction.",
    "observed_at": "2026-09-20T14:45:00Z",
    "valid_from": "2026-09-20T14:45:00Z",
    "valid_to": null
  },
  {
    "id": "PROV-050008",
    "source_id": "SRC-050008",
    "retrieved_at": "2026-09-20T14:45:00Z",
    "canonical_url": "https://www.nature.com/articles/nature16932",
    "external_version": null,
    "content_hash": null,
    "license": null,
    "independence_group": "https://www.nature.com/articles/nature16932",
    "derived_from_source_ids": [],
    "notes": "FE-05 foundational baseline provenance; canonical source checked during baseline construction.",
    "observed_at": "2026-09-20T14:45:00Z",
    "valid_from": "2026-09-20T14:45:00Z",
    "valid_to": null
  },
  {
    "id": "PROV-050009",
    "source_id": "SRC-050009",
    "retrieved_at": "2026-09-20T14:45:00Z",
    "canonical_url": "https://pubmed.ncbi.nlm.nih.gov/29576535/",
    "external_version": null,
    "content_hash": null,
    "license": null,
    "independence_group": "https://pubmed.ncbi.nlm.nih.gov/29576535/",
    "derived_from_source_ids": [],
    "notes": "FE-05 foundational baseline provenance; canonical source checked during baseline construction.",
    "observed_at": "2026-09-20T14:45:00Z",
    "valid_from": "2026-09-20T14:45:00Z",
    "valid_to": null
  },
  {
    "id": "PROV-050010",
    "source_id": "SRC-050010",
    "retrieved_at": "2026-09-20T14:45:00Z",
    "canonical_url": "https://www.nature.com/articles/s43587-022-00357-y",
    "external_version": null,
    "content_hash": null,
    "license": null,
    "independence_group": "https://www.nature.com/articles/s43587-022-00357-y",
    "derived_from_source_ids": [],
    "notes": "FE-05 foundational baseline provenance; canonical source checked during baseline construction.",
    "observed_at": "2026-09-20T14:45:00Z",
    "valid_from": "2026-09-20T14:45:00Z",
    "valid_to": null
  },
  {
    "id": "PROV-050011",
    "source_id": "SRC-050011",
    "retrieved_at": "2026-09-20T14:45:00Z",
    "canonical_url": "https://www.sciencedirect.com/science/article/abs/pii/S0140673611605473",
    "external_version": null,
    "content_hash": null,
    "license": null,
    "independence_group": "https://www.sciencedirect.com/science/article/abs/pii/S0140673611605473",
    "derived_from_source_ids": [],
    "notes": "FE-05 foundational baseline provenance; canonical source checked during baseline construction.",
    "observed_at": "2026-09-20T14:45:00Z",
    "valid_from": "2026-09-20T14:45:00Z",
    "valid_to": null
  },
  {
    "id": "PROV-050012",
    "source_id": "SRC-050012",
    "retrieved_at": "2026-09-20T14:45:00Z",
    "canonical_url": "https://www.nature.com/articles/s41586-018-0649-2",
    "external_version": null,
    "content_hash": null,
    "license": null,
    "independence_group": "https://www.nature.com/articles/s41586-018-0649-2",
    "derived_from_source_ids": [],
    "notes": "FE-05 foundational baseline provenance; canonical source checked during baseline construction.",
    "observed_at": "2026-09-20T14:45:00Z",
    "valid_from": "2026-09-20T14:45:00Z",
    "valid_to": null
  },
  {
    "id": "PROV-050013",
    "source_id": "SRC-050013",
    "retrieved_at": "2026-09-20T14:45:00Z",
    "canonical_url": "https://pubmed.ncbi.nlm.nih.gov/31587955/",
    "external_version": null,
    "content_hash": null,
    "license": null,
    "independence_group": "https://pubmed.ncbi.nlm.nih.gov/31587955/",
    "derived_from_source_ids": [],
    "notes": "FE-05 foundational baseline provenance; canonical source checked during baseline construction.",
    "observed_at": "2026-09-20T14:45:00Z",
    "valid_from": "2026-09-20T14:45:00Z",
    "valid_to": null
  },
  {
    "id": "PROV-050014",
    "source_id": "SRC-050014",
    "retrieved_at": "2026-09-20T14:45:00Z",
    "canonical_url": "https://www.nature.com/articles/s41591-021-01663-5",
    "external_version": null,
    "content_hash": null,
    "license": null,
    "independence_group": "https://www.nature.com/articles/s41591-021-01663-5",
    "derived_from_source_ids": [],
    "notes": "FE-05 foundational baseline provenance; canonical source checked during baseline construction.",
    "observed_at": "2026-09-20T14:45:00Z",
    "valid_from": "2026-09-20T14:45:00Z",
    "valid_to": null
  },
  {
    "id": "PROV-050015",
    "source_id": "SRC-050015",
    "retrieved_at": "2026-09-20T14:45:00Z",
    "canonical_url": "https://www.nature.com/articles/s41586-023-06094-5",
    "external_version": null,
    "content_hash": null,
    "license": null,
    "independence_group": "https://www.nature.com/articles/s41586-023-06094-5",
    "derived_from_source_ids": [],
    "notes": "FE-05 foundational baseline provenance; canonical source checked during baseline construction.",
    "observed_at": "2026-09-20T14:45:00Z",
    "valid_from": "2026-09-20T14:45:00Z",
    "valid_to": null
  },
  {
    "id": "PROV-050016",
    "source_id": "SRC-050016",
    "retrieved_at": "2026-09-20T14:45:00Z",
    "canonical_url": "https://www.accessdata.fda.gov/scripts/cdrh/cfdocs/cfhde/hde.cfm?id=375562",
    "external_version": null,
    "content_hash": null,
    "license": null,
    "independence_group": "https://www.accessdata.fda.gov/scripts/cdrh/cfdocs/cfhde/hde.cfm?id=375562",
    "derived_from_source_ids": [],
    "notes": "FE-05 foundational baseline provenance; canonical source checked during baseline construction.",
    "observed_at": "2026-09-20T14:45:00Z",
    "valid_from": "2026-09-20T14:45:00Z",
    "valid_to": null
  },
  {
    "id": "PROV-050017",
    "source_id": "SRC-050017",